{
  "schemaVersion": 2,
  "contentRevision": "ws-content-r2.1",
  "domain": "personal-augments",
  "records": [
    {
      "id": "AUG-S-001",
      "sourceDocumentId": "AUG-LIST-001",
      "enabled": true,
      "name": "가벼운 발걸음",
      "tier": "SILVER",
      "scope": "PERSONAL",
      "tags": [
        "DODGE",
        "AP",
        "BRIDGE"
      ],
      "effectOpcode": "DODGE_AP_COST_FLAT_REDUCE",
      "effectText": "회피 AP 비용 -4",
      "constraintText": "최소 비용 하한 적용",
      "weightingText": "없음",
      "exclusiveWith": [],
      "evolution": false,
      "executionSourceDocumentId": "AUGMENT-EFFECT-LIST-001",
      "triggerIds": [
        "DODGE_COST_QUERY"
      ],
      "stateScope": "PLAYER",
      "parameterPayload": "dodgeApFlat=-4",
      "limitFallback": "finalCostMin=COMBAT_DODGE_COST_FLOOR",
      "derivedEventFlags": [
        "NO_AUGMENT_RETRIGGER",
        "NO_REWARD",
        "NO_CONTRIBUTION"
      ],
      "raw": [
        "AUG-S-001",
        "가벼운 발걸음",
        "DODGE`, `AP`, `BRIDGE",
        "회피 AP 비용 -4",
        "최소 비용 하한 적용",
        "없음"
      ]
    },
    {
      "id": "AUG-S-002",
      "sourceDocumentId": "AUG-LIST-001",
      "enabled": true,
      "name": "숨 고르기",
      "tier": "SILVER",
      "scope": "PERSONAL",
      "tags": [
        "AP",
        "RECOVERY",
        "BRIDGE"
      ],
      "effectOpcode": "AP_REGEN_AFTER_DAMAGE_FREE_WINDOW",
      "effectText": "피해를 받지 않은 4초 후 AP 회복 +3/초",
      "constraintText": "전투 중에도 조건 검사",
      "weightingText": "없음",
      "exclusiveWith": [],
      "evolution": false,
      "executionSourceDocumentId": "AUGMENT-EFFECT-LIST-001",
      "triggerIds": [
        "DAMAGE_TAKEN_COMMITTED",
        "COMBAT_TICK"
      ],
      "stateScope": "PLAYER_ENCOUNTER",
      "parameterPayload": "damageFreeTicks=80; apRegenPerSecond=3",
      "limitFallback": "combatAllowed=true; resetOnValidDamage=true",
      "derivedEventFlags": [
        "NO_AUGMENT_RETRIGGER",
        "NO_REWARD",
        "NO_CONTRIBUTION"
      ],
      "raw": [
        "AUG-S-002",
        "숨 고르기",
        "AP`, `RECOVERY`, `BRIDGE",
        "피해를 받지 않은 4초 후 AP 회복 +3/초",
        "전투 중에도 조건 검사",
        "없음"
      ]
    },
    {
      "id": "AUG-S-003",
      "sourceDocumentId": "AUG-LIST-001",
      "enabled": true,
      "name": "응급 지혈",
      "tier": "SILVER",
      "scope": "PERSONAL",
      "tags": [
        "SURVIVAL",
        "BLEED",
        "BRIDGE"
      ],
      "effectOpcode": "BLEED_DURATION_REDUCE_AND_CLEAR_HEAL",
      "effectText": "받는 출혈 지속시간 -25%, 출혈 해제 시 HP 2% 회복",
      "constraintText": "8초",
      "weightingText": "없음",
      "exclusiveWith": [],
      "evolution": false,
      "executionSourceDocumentId": "AUGMENT-EFFECT-LIST-001",
      "triggerIds": [
        "STATUS_DURATION_QUERY",
        "STATUS_CLEARED"
      ],
      "stateScope": "PLAYER",
      "parameterPayload": "bleedDurationMultiplier=0.75; clearHealMaxHp=0.02",
      "limitFallback": "icdTicks=160; nonBleedClear=false",
      "derivedEventFlags": [
        "NO_AUGMENT_RETRIGGER",
        "NO_REWARD",
        "NO_CONTRIBUTION"
      ],
      "raw": [
        "AUG-S-003",
        "응급 지혈",
        "SURVIVAL`, `BLEED`, `BRIDGE",
        "받는 출혈 지속시간 -25%, 출혈 해제 시 HP 2% 회복",
        "8초",
        "없음"
      ]
    },
    {
      "id": "AUG-S-004",
      "sourceDocumentId": "AUG-LIST-001",
      "enabled": true,
      "name": "정화 호흡",
      "tier": "SILVER",
      "scope": "PERSONAL",
      "tags": [
        "CORRUPTION",
        "SURVIVAL"
      ],
      "effectOpcode": "CORRUPTION_GAIN_REDUCE_AND_PURIFY_SCALE",
      "effectText": "개인 오염 획득 -10%, 정화 소모품 효과 +10%",
      "constraintText": "오염 감소 하한 적용",
      "weightingText": "없음",
      "exclusiveWith": [],
      "evolution": false,
      "executionSourceDocumentId": "AUGMENT-EFFECT-LIST-001",
      "triggerIds": [
        "CORRUPTION_GAIN_QUERY",
        "CONSUMABLE_EFFECT_QUERY"
      ],
      "stateScope": "PLAYER",
      "parameterPayload": "corruptionGainMultiplier=0.90; purifyConsumableMultiplier=1.10",
      "limitFallback": "corruptionFloor=0; statusCleanseBonus=0",
      "derivedEventFlags": [
        "NO_AUGMENT_RETRIGGER",
        "NO_REWARD",
        "NO_CONTRIBUTION"
      ],
      "raw": [
        "AUG-S-004",
        "정화 호흡",
        "CORRUPTION`, `SURVIVAL",
        "개인 오염 획득 -10%, 정화 소모품 효과 +10%",
        "오염 감소 하한 적용",
        "없음"
      ]
    },
    {
      "id": "AUG-S-005",
      "sourceDocumentId": "AUG-LIST-001",
      "enabled": true,
      "name": "견고한 중심",
      "tier": "SILVER",
      "scope": "PERSONAL",
      "tags": [
        "GUARD",
        "PARRY"
      ],
      "effectOpcode": "GUARD_IMPACT_REDUCE_AND_FAILED_PARRY_SHORT_GUARD_EXTEND",
      "effectText": "가드 충격 AP -12%, 패링 실패 뒤 단기 방어 +0.10초",
      "constraintText": "행동당 1회",
      "weightingText": "없음",
      "exclusiveWith": [],
      "evolution": false,
      "executionSourceDocumentId": "AUGMENT-EFFECT-LIST-001",
      "triggerIds": [
        "GUARD_RESOLVED",
        "PARRY_RESOLVED",
        "SHORT_GUARD_DURATION_QUERY"
      ],
      "stateScope": "PLAYER_ACTION",
      "parameterPayload": "guardImpactApMultiplier=0.88; failedParryShortGuardExtendTicks=2",
      "limitFallback": "perActionMax=1",
      "derivedEventFlags": [
        "NO_AUGMENT_RETRIGGER",
        "NO_REWARD",
        "NO_CONTRIBUTION"
      ],
      "raw": [
        "AUG-S-005",
        "견고한 중심",
        "GUARD`, `PARRY",
        "가드 충격 AP -12%, 패링 실패 뒤 단기 방어 +0.10초",
        "행동당 1회",
        "없음"
      ]
    },
    {
      "id": "AUG-S-006",
      "sourceDocumentId": "AUG-LIST-001",
      "enabled": true,
      "name": "약점 기록",
      "tier": "SILVER",
      "scope": "PERSONAL",
      "tags": [
        "BREAK",
        "MARK"
      ],
      "effectOpcode": "TARGET_HIT_STREAK_BREAK_WINDOW",
      "effectText": "같은 대상 3회 유효 적중 시 4초간 브레이크 피해 +12%",
      "constraintText": "대상별 6초",
      "weightingText": "브레이크 비적용 대상 제외",
      "exclusiveWith": [],
      "evolution": false,
      "executionSourceDocumentId": "AUGMENT-EFFECT-LIST-001",
      "triggerIds": [
        "COMBAT_HIT_COMMITTED"
      ],
      "stateScope": "PLAYER_TARGET",
      "parameterPayload": "requiredHits=3; hitWindowTicks=80; breakMultiplier=1.12; buffTicks=80",
      "limitFallback": "targetIcdTicks=120; noBreakTarget=INELIGIBLE",
      "derivedEventFlags": [
        "NO_AUGMENT_RETRIGGER",
        "NO_REWARD",
        "NO_CONTRIBUTION"
      ],
      "raw": [
        "AUG-S-006",
        "약점 기록",
        "BREAK`, `MARK",
        "같은 대상 3회 유효 적중 시 4초간 브레이크 피해 +12%",
        "대상별 6초",
        "브레이크 비적용 대상 제외"
      ]
    },
    {
      "id": "AUG-S-007",
      "sourceDocumentId": "AUG-LIST-001",
      "enabled": true,
      "name": "정밀 반복",
      "tier": "SILVER",
      "scope": "PERSONAL",
      "tags": [
        "COMBO",
        "HIT"
      ],
      "effectOpcode": "COMBO_FINISHER_NEXT_BASIC_HIT_BUFF",
      "effectText": "콤보 마지막 단계 명중 시 다음 일반 공격 HIT +12",
      "constraintText": "4초, 중첩 없음",
      "weightingText": "콤보 무기 가중",
      "exclusiveWith": [],
      "evolution": false,
      "executionSourceDocumentId": "AUGMENT-EFFECT-LIST-001",
      "triggerIds": [
        "COMBO_FINISHER_HIT",
        "BASIC_ATTACK_RESOLVED"
      ],
      "stateScope": "PLAYER",
      "parameterPayload": "nextBasicHitFlat=12; expiryTicks=80",
      "limitFallback": "stacksMax=1; comboWeaponsWeighted=true",
      "derivedEventFlags": [
        "NO_AUGMENT_RETRIGGER",
        "NO_REWARD",
        "NO_CONTRIBUTION"
      ],
      "raw": [
        "AUG-S-007",
        "정밀 반복",
        "COMBO`, `HIT",
        "콤보 마지막 단계 명중 시 다음 일반 공격 HIT +12",
        "4초, 중첩 없음",
        "콤보 무기 가중"
      ]
    },
    {
      "id": "AUG-S-008",
      "sourceDocumentId": "AUG-LIST-001",
      "enabled": true,
      "name": "예비 탄약",
      "tier": "SILVER",
      "scope": "PERSONAL",
      "tags": [
        "AMMO",
        "RANGED"
      ],
      "effectOpcode": "NORMAL_AMMO_CONSERVE_ROLL",
      "effectText": "일반 탄약 소비 시 15% 확률로 미소비",
      "constraintText": "시전당 1회",
      "weightingText": "활·석궁 가중",
      "exclusiveWith": [],
      "evolution": false,
      "executionSourceDocumentId": "AUGMENT-EFFECT-LIST-001",
      "triggerIds": [
        "AMMO_CONSUME_REQUESTED"
      ],
      "stateScope": "PLAYER_CAST",
      "parameterPayload": "normalAmmoConserveChance=0.15",
      "limitFallback": "perCastRollMax=1; specialAmmo=false",
      "derivedEventFlags": [
        "NO_AUGMENT_RETRIGGER",
        "NO_REWARD",
        "NO_CONTRIBUTION"
      ],
      "raw": [
        "AUG-S-008",
        "예비 탄약",
        "AMMO`, `RANGED",
        "일반 탄약 소비 시 15% 확률로 미소비",
        "시전당 1회",
        "활·석궁 가중"
      ]
    },
    {
      "id": "AUG-S-009",
      "sourceDocumentId": "AUG-LIST-001",
      "enabled": true,
      "name": "빠른 손질",
      "tier": "SILVER",
      "scope": "PERSONAL",
      "tags": [
        "RELOAD",
        "RANGED"
      ],
      "effectOpcode": "RELOAD_TIME_AND_MOVE_PENALTY_REDUCE",
      "effectText": "장전시간 -10%, 장전 중 이동 페널티 -10%",
      "constraintText": "장전 하한 적용",
      "weightingText": "석궁 가중",
      "exclusiveWith": [],
      "evolution": false,
      "executionSourceDocumentId": "AUGMENT-EFFECT-LIST-001",
      "triggerIds": [
        "RELOAD_PROFILE_QUERY"
      ],
      "stateScope": "PLAYER",
      "parameterPayload": "reloadTimeMultiplier=0.90; reloadMovePenaltyMultiplier=0.90",
      "limitFallback": "reloadFloor=WEAPON_PROFILE_FLOOR; crossbowWeighted=true",
      "derivedEventFlags": [
        "NO_AUGMENT_RETRIGGER",
        "NO_REWARD",
        "NO_CONTRIBUTION"
      ],
      "raw": [
        "AUG-S-009",
        "빠른 손질",
        "RELOAD`, `RANGED",
        "장전시간 -10%, 장전 중 이동 페널티 -10%",
        "장전 하한 적용",
        "석궁 가중"
      ]
    },
    {
      "id": "AUG-S-010",
      "sourceDocumentId": "AUG-LIST-001",
      "enabled": true,
      "name": "잔류 마력",
      "tier": "SILVER",
      "scope": "PERSONAL",
      "tags": [
        "MAGIC",